{
  "$schema":"https://json-schema.org/draft/2020-12/schema",
  "type":"array",
  "items":{
    "type":"object",
    "required":["id","extensions","filenames","category","roles","name","description","isText","isBinary"],
    "additionalProperties":false,
    "properties":{
      "id":{"type":"string","pattern":"^[a-z0-9][a-z0-9-]*$"},
      "extensions":{"type":"array","items":{"type":"string","pattern":"^[a-z0-9][a-z0-9+._-]*$"},"uniqueItems":true},
      "filenames":{"type":"array","items":{"type":"string","minLength":1},"uniqueItems":true},
      "category":{"type":"string","enum":["document","spreadsheet","image","rawImage","audio","video","archive","sourceCode","configuration","database","scientificData","aiModel","threeD","font","executable","project","unknown"]},
      "roles":{"type":"array","minItems":1,"items":{"type":"string"},"uniqueItems":true},
      "name":{"$ref":"#/$defs/localized"},
      "description":{"$ref":"#/$defs/localized"},
      "purpose":{"$ref":"#/$defs/localized"},
      "importance":{"type":"object","required":["reason","priority"],"additionalProperties":false,"properties":{"reason":{"type":"string"},"priority":{"type":"integer"}}},
      "isText":{"type":"boolean"},
      "isBinary":{"type":"boolean"}
    }
  },
  "$defs":{"localized":{"type":"object","required":["en","zh-Hans"],"additionalProperties":false,"properties":{"en":{"type":"string","minLength":1},"zh-Hans":{"type":"string","minLength":1}}}}
}
