[
  {
    "id": "pdf",
    "extensions": [
      "pdf"
    ],
    "category": "document",
    "name": {
      "en": "PDF Document",
      "zh-Hans": "PDF 文档"
    },
    "description": {
      "en": "Portable Document Format document.",
      "zh-Hans": "便携式文档格式文件。"
    },
    "purpose": {
      "en": "Used for fixed-layout documents.",
      "zh-Hans": "用于保留固定版式的文档。"
    },
    "isText": false,
    "isBinary": true,
    "roles": [
      "document"
    ],
    "filenames": []
  },
  {
    "id": "word-document",
    "extensions": [
      "doc",
      "docx",
      "odt",
      "pages"
    ],
    "category": "document",
    "name": {
      "en": "Word Processing Document",
      "zh-Hans": "文字处理文档"
    },
    "description": {
      "en": "Editable rich-text document.",
      "zh-Hans": "可编辑的富文本文件。"
    },
    "purpose": {
      "en": "Used for letters, reports and other written documents.",
      "zh-Hans": "常用于信件、报告和其他文字文档。"
    },
    "isText": false,
    "isBinary": true,
    "roles": [
      "document"
    ],
    "filenames": []
  },
  {
    "id": "plain-text",
    "extensions": [
      "markdown",
      "md",
      "org",
      "rst",
      "rtf",
      "text",
      "txt"
    ],
    "category": "document",
    "name": {
      "en": "Text Document",
      "zh-Hans": "文本文件"
    },
    "description": {
      "en": "Human-readable text document.",
      "zh-Hans": "可直接阅读的文本文件。"
    },
    "purpose": {
      "en": "Used for notes, documentation or formatted text.",
      "zh-Hans": "用于笔记、文档或带格式的文本。"
    },
    "isText": true,
    "isBinary": false,
    "roles": [
      "document"
    ],
    "filenames": []
  },
  {
    "id": "ebook",
    "extensions": [
      "azw",
      "azw3",
      "epub",
      "fb2",
      "mobi"
    ],
    "category": "document",
    "name": {
      "en": "eBook",
      "zh-Hans": "电子书"
    },
    "description": {
      "en": "Digital book file.",
      "zh-Hans": "数字书籍文件。"
    },
    "purpose": {
      "en": "Used by eBook readers.",
      "zh-Hans": "用于电子书阅读器。"
    },
    "isText": false,
    "isBinary": true,
    "roles": [
      "document"
    ],
    "filenames": []
  },
  {
    "id": "presentation",
    "extensions": [
      "key",
      "odp",
      "ppt",
      "pptx"
    ],
    "category": "document",
    "name": {
      "en": "Presentation",
      "zh-Hans": "演示文稿"
    },
    "description": {
      "en": "Slide-based presentation document.",
      "zh-Hans": "以幻灯片组织的演示文稿。"
    },
    "purpose": {
      "en": "Used for talks and visual presentations.",
      "zh-Hans": "用于演讲和视觉展示。"
    },
    "isText": false,
    "isBinary": true,
    "roles": [
      "document"
    ],
    "filenames": []
  },
  {
    "id": "excel-spreadsheet",
    "extensions": [
      "numbers",
      "ods",
      "xls",
      "xlsb",
      "xlsm",
      "xlsx"
    ],
    "category": "spreadsheet",
    "name": {
      "en": "Spreadsheet",
      "zh-Hans": "电子表格"
    },
    "description": {
      "en": "Workbook containing tables, formulas or charts.",
      "zh-Hans": "包含表格、公式或图表的工作簿。"
    },
    "purpose": {
      "en": "Used to organize and calculate tabular data.",
      "zh-Hans": "用于整理和计算表格数据。"
    },
    "isText": false,
    "isBinary": true,
    "roles": [
      "dataset"
    ],
    "filenames": []
  },
  {
    "id": "csv",
    "extensions": [
      "csv",
      "tab",
      "tsv"
    ],
    "category": "spreadsheet",
    "name": {
      "en": "Delimited Table",
      "zh-Hans": "分隔表格数据"
    },
    "description": {
      "en": "Plain-text table with delimiter-separated values.",
      "zh-Hans": "以分隔符划分字段的纯文本表格。"
    },
    "purpose": {
      "en": "Used to exchange tabular data between applications.",
      "zh-Hans": "用于在应用间交换表格数据。"
    },
    "isText": true,
    "isBinary": false,
    "roles": [
      "dataset"
    ],
    "filenames": []
  },
  {
    "id": "jpeg",
    "extensions": [
      "jfif",
      "jpe",
      "jpeg",
      "jpg"
    ],
    "category": "image",
    "name": {
      "en": "JPEG Image",
      "zh-Hans": "JPEG 图像"
    },
    "description": {
      "en": "Compressed photographic image.",
      "zh-Hans": "压缩的照片图像。"
    },
    "purpose": {
      "en": "Commonly used for photographs and web images.",
      "zh-Hans": "常用于照片和网页图像。"
    },
    "isText": false,
    "isBinary": true,
    "roles": [
      "image"
    ],
    "filenames": []
  },
  {
    "id": "png",
    "extensions": [
      "apng",
      "png"
    ],
    "category": "image",
    "name": {
      "en": "PNG Image",
      "zh-Hans": "PNG 图像"
    },
    "description": {
      "en": "Lossless raster image.",
      "zh-Hans": "无损位图图像。"
    },
    "purpose": {
      "en": "Commonly used for graphics and images with transparency.",
      "zh-Hans": "常用于图形和带透明度的图像。"
    },
    "isText": false,
    "isBinary": true,
    "roles": [
      "image"
    ],
    "filenames": []
  },
  {
    "id": "web-image",
    "extensions": [
      "avif",
      "bmp",
      "gif",
      "heic",
      "heif",
      "icns",
      "ico",
      "tif",
      "tiff",
      "webp"
    ],
    "category": "image",
    "name": {
      "en": "Raster Image",
      "zh-Hans": "位图图像"
    },
    "description": {
      "en": "Raster image in a common image format.",
      "zh-Hans": "采用常见图像格式的位图。"
    },
    "purpose": {
      "en": "Used for graphics, photography or application icons.",
      "zh-Hans": "用于图形、摄影或应用图标。"
    },
    "isText": false,
    "isBinary": true,
    "roles": [
      "image"
    ],
    "filenames": []
  },
  {
    "id": "svg",
    "extensions": [
      "svg",
      "svgz"
    ],
    "category": "image",
    "name": {
      "en": "SVG Vector Image",
      "zh-Hans": "SVG 矢量图像"
    },
    "description": {
      "en": "Scalable vector graphics image.",
      "zh-Hans": "可缩放的矢量图形图像。"
    },
    "purpose": {
      "en": "Used for resolution-independent illustrations and icons.",
      "zh-Hans": "用于与分辨率无关的插图和图标。"
    },
    "isText": true,
    "isBinary": false,
    "roles": [
      "image"
    ],
    "filenames": []
  },
  {
    "id": "camera-raw",
    "extensions": [
      "3fr",
      "arw",
      "cr2",
      "cr3",
      "dng",
      "iiq",
      "nef",
      "orf",
      "pef",
      "raf",
      "rw2",
      "srw"
    ],
    "category": "rawImage",
    "name": {
      "en": "Camera RAW Image",
      "zh-Hans": "相机 RAW 图像"
    },
    "description": {
      "en": "Raw sensor data captured by a digital camera.",
      "zh-Hans": "由数码相机采集的原始传感器数据。"
    },
    "purpose": {
      "en": "Used for non-destructive professional photo editing.",
      "zh-Hans": "用于无损的专业照片编辑。"
    },
    "isText": false,
    "isBinary": true,
    "roles": [
      "rawImage",
      "image"
    ],
    "filenames": []
  },
  {
    "id": "mp3",
    "extensions": [
      "aac",
      "aif",
      "aiff",
      "alac",
      "flac",
      "m4a",
      "mp2",
      "mp3",
      "ogg",
      "opus",
      "wav",
      "wma"
    ],
    "category": "audio",
    "name": {
      "en": "Audio File",
      "zh-Hans": "音频文件"
    },
    "description": {
      "en": "Digital audio recording or music file.",
      "zh-Hans": "数字音频录制或音乐文件。"
    },
    "purpose": {
      "en": "Used for music, speech and sound effects.",
      "zh-Hans": "用于音乐、语音和音效。"
    },
    "isText": false,
    "isBinary": true,
    "roles": [
      "audio"
    ],
    "filenames": []
  },
  {
    "id": "video",
    "extensions": [
      "3gp",
      "avi",
      "flv",
      "m4v",
      "mkv",
      "mov",
      "mp4",
      "mpeg",
      "mpg",
      "ts",
      "webm",
      "wmv"
    ],
    "category": "video",
    "name": {
      "en": "Video File",
      "zh-Hans": "视频文件"
    },
    "description": {
      "en": "Digital video container.",
      "zh-Hans": "数字视频容器文件。"
    },
    "purpose": {
      "en": "Used for recorded or streamed video.",
      "zh-Hans": "用于录制或流式视频。"
    },
    "isText": false,
    "isBinary": true,
    "roles": [
      "video"
    ],
    "filenames": []
  },
  {
    "id": "zip",
    "extensions": [
      "ipa",
      "jar",
      "xpi",
      "zip",
      "zipx"
    ],
    "category": "archive",
    "name": {
      "en": "ZIP Archive",
      "zh-Hans": "ZIP 压缩包"
    },
    "description": {
      "en": "Archive containing one or more compressed files.",
      "zh-Hans": "包含一个或多个压缩文件的归档。"
    },
    "purpose": {
      "en": "Used to package and compress files.",
      "zh-Hans": "用于打包和压缩文件。"
    },
    "isText": false,
    "isBinary": true,
    "roles": [
      "archive"
    ],
    "filenames": []
  },
  {
    "id": "tar-archive",
    "extensions": [
      "bz2",
      "gz",
      "lz",
      "lzma",
      "tar",
      "tbz",
      "tbz2",
      "tgz",
      "txz",
      "xz",
      "zst"
    ],
    "category": "archive",
    "name": {
      "en": "Compressed Archive",
      "zh-Hans": "压缩归档"
    },
    "description": {
      "en": "Compressed archive or archive stream.",
      "zh-Hans": "压缩归档或归档数据流。"
    },
    "purpose": {
      "en": "Used to distribute or back up groups of files.",
      "zh-Hans": "用于分发或备份一组文件。"
    },
    "isText": false,
    "isBinary": true,
    "roles": [
      "archive"
    ],
    "filenames": []
  },
  {
    "id": "other-archive",
    "extensions": [
      "7z",
      "arj",
      "cab",
      "iso",
      "lzh",
      "rar"
    ],
    "category": "archive",
    "name": {
      "en": "Archive Image",
      "zh-Hans": "归档映像"
    },
    "description": {
      "en": "Packaged archive or disk-image file.",
      "zh-Hans": "打包的归档或磁盘映像文件。"
    },
    "purpose": {
      "en": "Used to store or distribute collections of files.",
      "zh-Hans": "用于存储或分发文件集合。"
    },
    "isText": false,
    "isBinary": true,
    "roles": [
      "archive"
    ],
    "filenames": []
  },
  {
    "id": "python",
    "extensions": [
      "py",
      "pyi",
      "pyw",
      "pyx"
    ],
    "category": "sourceCode",
    "name": {
      "en": "Python Source Code",
      "zh-Hans": "Python 源代码"
    },
    "description": {
      "en": "Program source written in Python.",